title,summary,publication_date,source,url,category
Report finds ‘no evidence’ Hawaii officials prepared for Maui wildfire that killed 102 despite warnings | CNN,"Honolulu (AP) — Investigators reviewing the emergency response to last year’s wildfire that killed 102 people on Maui said in a report released Friday they found “no evidence” Hawaii officials made preparations for it, despite days of warnings that critical fire weather was coming. That lack of planning hindered efforts to evacuate the historic town of Lahaina before it burned, the report said. A forecaster with the National Weather Service emailed fire managers an “unprecedented advance warning” on August 4, 2023, of the danger that would develop on Aug. 8, including extreme winds as a hurricane passed far to the south, according to the report released by the state attorney general.",2024-09-14,CNN,https://www.cnn.com/2024/09/14/us/hawaii-maui-wildfire-report/index.html,other
China’s secretive space plane has returned to Earth | CNN,"Editor’s Note: Sign up for CNN’s Meanwhile in China newsletter which explores what you need to know about the country’s rise and how it impacts the world. A Chinese “reusable experimental spacecraft” believed to be the country’s secretive space plane has landed back on Earth after more than eight months in orbit – the latest development in a largely covert race between the United States and China to hone such technology. China’s spacecraft blasted into orbit last December – two weeks ahead of the latest launch of the US military’s own Boeing X-37B uncrewed space plane – on the third known orbital mission of such a Chinese spacecraft. Some 268 days later, the spacecraft returned to an unnamed landing site, according to a brief September 6 announcement from state news agency Xinhua, which declared its test mission a “complete success.” China’s development of the vehicle, about which little is publicly known, comes after recent years of striving to catch up to the US, long the world’s preeminent space power, for dominance in orbit and beyond.",2024-09-12,CNN,https://www.cnn.com/2024/09/12/science/china-space-plane-intl-hnk/index.html,technology
SpaceX Polaris Dawn spacewalk: Why it was a historic milestone | CNN,"Sign up for CNN’s Wonder Theory science newsletter. Explore the universe with news on fascinating discoveries, scientific advancements and more . SpaceX’s Polaris Dawn crew is beginning its fifth day in orbit, having marked a few record-setting milestones on a historic journey — including the world’s first commercial spacewalk. Conducting a spacewalk is nothing new.",2024-09-14,CNN,https://www.cnn.com/2024/09/14/science/spacex-polaris-dawn-spacewalk-historic-milestone/index.html,science
What this Boeing strike is really all about | CNN Business,"Markets Hot Stocks Fear & Greed Index Latest Market News Hot Stocks At the heart of the Boeing strike that began Friday is a story about what happens when penny-pinching executives lose the plot and it falls to workers to get everyone back on track. Last year, Boeing didn’t make a profit. In fact, the plane maker has lost money every year since 2018, when a series of deadly crashes and near-disasters left its reputation and finances in the gutter. If Boeing were any other business — and not a too-big-fail half of a global duopoly — it almost certainly would have declared bankruptcy.",2024-09-14,CNN,https://www.cnn.com/2024/09/14/business/boeing-workers-strike/index.html,business
The Sahara Desert is greening as unusual storms hit parts of Africa | CNN,"There isn’t much green in the Sahara Desert, but after an unusual influx of rain, the color can be seen from space creeping into parts of one of the driest places in the world. Satellites recently captured plant life blooming in parts of the typically arid southern Sahara after storms moved there when they shouldn’t. It has also caused catastrophic flooding. And scientists say a world warming due to fossil fuel pollution is making both more likely.",2024-09-13,CNN,https://www.cnn.com/2024/09/13/weather/sahara-desert-green-climate/index.html,science
Fact check: Trump falsely claims every poll says he won the debate | CNN Politics,Former President Donald Trump has returned to a time-honored tradition of his: citing junk online polls to claim he was the clear winner of a presidential debate that scientific polls found he lost. He did it in 2016 after his debates against Hillary Clinton. He did it in 2020 after he debated Joe Biden. And he did it again on Wednesday after facing off against Vice President Kamala Harris the previous night.,2024-09-12,CNN,https://www.cnn.com/2024/09/12/politics/fact-check-trump-claims-won-debate/index.html,politics
Fate of US Steel merger expected to be pushed beyond election day as politics cloud outlook | CNN Business,"Markets Hot Stocks Fear & Greed Index Latest Market News Hot Stocks As presidential politics cloud the outlook of US Steel’s merger with its Japanese rival, a national security review of the deal is now not expected to be decided until after the election, according to people familiar with the matter. The Committee on Foreign Investment in the United States, which evaluates the national security risks posed by deals with foreign entities, is expected to deliver its recommendation to the White House after November 5, these people said. That timeline is meant to ensure that any recommendation is made outside the pressure cooker of an election cycle, in which all political parties have come out against the deal. US Steel’s share price climbed significantly Friday after The Washington Post first reported that White House officials are signaling President Joe Biden will not imminently move to block the deal.",2024-09-13,CNN,https://www.cnn.com/2024/09/13/business/us-steel-merger-biden-white-house/index.html,politics
Jon Rahm appeals DP World Tour fines in fight to make Ryder Cup | CNN,"Spanish golfer Jon Rahm appealed against outstanding fines to the DP World Tour on Thursday which had thrown his hopes of competing at next year’s Ryder Cup into jeopardy. The two-time major winner originally insisted Wednesday that he had no intention of paying the penalty fees incurred due to his participation in LIV Golf events, escalating the possibility of Team Europe heading into next year’s Ryder Cup without one of its biggest stars. Rahm played a pivotal role in routing the United States in Rome last October , but to be eligible to return to captain Luke Donald’s team for New York, the 29-year-old needs to be a member of the DP World Tour, formerly known as the European Tour. To retain his membership, he must play in three further events on the circuit before its season concludes with the Tour Championship in Dubai on November 17.",2024-09-12,CNN,https://www.cnn.com/2024/09/12/sport/jon-rahm-ryder-cup-fines-spt-intl/index.html,sports
